{
  "schemaVersion": 1,
  "generatedFrom": "catalog/products.json",
  "catalogueStatus": "planned-not-release-evidence",
  "counts": {
    "total": 43,
    "standalone": 39,
    "launchKits": 4,
    "admittedStandaloneWorkspaces": 1,
    "manifestsPresent": 5,
    "released": 0
  },
  "entries": [
    {
      "sequence": 1,
      "productKey": "courier-logistics-template",
      "name": "Courier & Logistics Template",
      "tier": "Tier 1",
      "kind": "standalone",
      "catalogueStatus": "planned",
      "maturity": "scaffolded",
      "manifestPath": "products/courier-logistics-template/product.manifest.json",
      "sourcePath": "products/courier-logistics-template",
      "releaseEvidence": "not_available"
    },
    {
      "sequence": 2,
      "productKey": "loan-lending-template",
      "name": "Loan & Lending Template",
      "tier": "Tier 1",
      "kind": "standalone",
      "catalogueStatus": "planned",
      "maturity": "planned",
      "manifestPath": null,
      "sourcePath": null,
      "releaseEvidence": "not_available"
    },
    {
      "sequence": 3,
      "productKey": "neobank-digital-banking-template",
      "name": "NeoBank & Digital Banking Template",
      "tier": "Tier 1",
      "kind": "standalone",
      "catalogueStatus": "planned",
      "maturity": "planned",
      "manifestPath": null,
      "sourcePath": null,
      "releaseEvidence": "not_available"
    },
    {
      "sequence": 4,
      "productKey": "digital-agency-template",
      "name": "Digital Agency Template",
      "tier": "Tier 1",
      "kind": "standalone",
      "catalogueStatus": "planned",
      "maturity": "planned",
      "manifestPath": null,
      "sourcePath": null,
      "releaseEvidence": "not_available"
    },
    {
      "sequence": 5,
      "productKey": "saas-landing-page-template",
      "name": "SaaS Landing Page Template",
      "tier": "Tier 1",
      "kind": "standalone",
      "catalogueStatus": "planned",
      "maturity": "planned",
      "manifestPath": null,
      "sourcePath": null,
      "releaseEvidence": "not_available"
    },
    {
      "sequence": 6,
      "productKey": "portfolio-freelancer-template",
      "name": "Portfolio & Freelancer Template",
      "tier": "Tier 1",
      "kind": "standalone",
      "catalogueStatus": "planned",
      "maturity": "planned",
      "manifestPath": null,
      "sourcePath": null,
      "releaseEvidence": "not_available"
    },
    {
      "sequence": 7,
      "productKey": "saas-starter-kit",
      "name": "SaaS Starter Kit",
      "tier": "Tier 4",
      "kind": "launch-kit",
      "catalogueStatus": "planned",
      "maturity": "planned",
      "manifestPath": "kits/manifests/saas-starter-kit.json",
      "sourcePath": null,
      "releaseEvidence": "not_available"
    },
    {
      "sequence": 8,
      "productKey": "web3-dapp-kit",
      "name": "Web3 dApp Kit",
      "tier": "Tier 4",
      "kind": "launch-kit",
      "catalogueStatus": "planned",
      "maturity": "planned",
      "manifestPath": "kits/manifests/web3-dapp-kit.json",
      "sourcePath": null,
      "releaseEvidence": "not_available"
    },
    {
      "sequence": 9,
      "productKey": "fintech-launch-kit",
      "name": "Fintech Launch Kit",
      "tier": "Tier 4",
      "kind": "launch-kit",
      "catalogueStatus": "planned",
      "maturity": "planned",
      "manifestPath": "kits/manifests/fintech-launch-kit.json",
      "sourcePath": null,
      "releaseEvidence": "not_available"
    },
    {
      "sequence": 10,
      "productKey": "agency-starter-kit",
      "name": "Agency Starter Kit",
      "tier": "Tier 4",
      "kind": "launch-kit",
      "catalogueStatus": "planned",
      "maturity": "planned",
      "manifestPath": "kits/manifests/agency-starter-kit.json",
      "sourcePath": null,
      "releaseEvidence": "not_available"
    },
    {
      "sequence": 11,
      "productKey": "islamic-finance-halal-banking",
      "name": "Islamic Finance & Halal Banking",
      "tier": "Tier 5",
      "kind": "standalone",
      "catalogueStatus": "planned",
      "maturity": "planned",
      "manifestPath": null,
      "sourcePath": null,
      "releaseEvidence": "not_available"
    },
    {
      "sequence": 12,
      "productKey": "agritech-farm-marketplace",
      "name": "Agritech & Farm Marketplace",
      "tier": "Tier 5",
      "kind": "standalone",
      "catalogueStatus": "planned",
      "maturity": "planned",
      "manifestPath": null,
      "sourcePath": null,
      "releaseEvidence": "not_available"
    },
    {
      "sequence": 13,
      "productKey": "isp-telecom-template",
      "name": "ISP & Telecom Template",
      "tier": "Tier 5",
      "kind": "standalone",
      "catalogueStatus": "planned",
      "maturity": "planned",
      "manifestPath": null,
      "sourcePath": null,
      "releaseEvidence": "not_available"
    },
    {
      "sequence": 14,
      "productKey": "solar-energy-template",
      "name": "Solar Energy Template",
      "tier": "Tier 5",
      "kind": "standalone",
      "catalogueStatus": "planned",
      "maturity": "planned",
      "manifestPath": null,
      "sourcePath": null,
      "releaseEvidence": "not_available"
    },
    {
      "sequence": 15,
      "productKey": "ride-hailing-landing-page",
      "name": "Ride-Hailing Landing Page",
      "tier": "Tier 5",
      "kind": "standalone",
      "catalogueStatus": "planned",
      "maturity": "planned",
      "manifestPath": null,
      "sourcePath": null,
      "releaseEvidence": "not_available"
    },
    {
      "sequence": 16,
      "productKey": "ajo-esusu-cooperative-savings-script",
      "name": "Ajo / Esusu Cooperative Savings Script",
      "tier": "Tier 5",
      "kind": "standalone",
      "catalogueStatus": "planned",
      "maturity": "planned",
      "manifestPath": null,
      "sourcePath": null,
      "releaseEvidence": "not_available"
    },
    {
      "sequence": 17,
      "productKey": "p2p-crypto-platform-script",
      "name": "P2P Crypto Platform Script",
      "tier": "Tier 2",
      "kind": "standalone",
      "catalogueStatus": "planned",
      "maturity": "planned",
      "manifestPath": null,
      "sourcePath": null,
      "releaseEvidence": "not_available"
    },
    {
      "sequence": 18,
      "productKey": "online-banking-script",
      "name": "Online Banking Script",
      "tier": "Tier 2",
      "kind": "standalone",
      "catalogueStatus": "planned",
      "maturity": "planned",
      "manifestPath": null,
      "sourcePath": null,
      "releaseEvidence": "not_available"
    },
    {
      "sequence": 19,
      "productKey": "loan-management-script",
      "name": "Loan Management Script",
      "tier": "Tier 2",
      "kind": "standalone",
      "catalogueStatus": "planned",
      "maturity": "planned",
      "manifestPath": null,
      "sourcePath": null,
      "releaseEvidence": "not_available"
    },
    {
      "sequence": 20,
      "productKey": "nft-marketplace",
      "name": "NFT Marketplace",
      "tier": "Tier 2",
      "kind": "standalone",
      "catalogueStatus": "planned",
      "maturity": "planned",
      "manifestPath": null,
      "sourcePath": null,
      "releaseEvidence": "not_available"
    },
    {
      "sequence": 21,
      "productKey": "real-estate-template",
      "name": "Real Estate Template",
      "tier": "Tier 2",
      "kind": "standalone",
      "catalogueStatus": "planned",
      "maturity": "planned",
      "manifestPath": null,
      "sourcePath": null,
      "releaseEvidence": "not_available"
    },
    {
      "sequence": 22,
      "productKey": "invoice-billing-script",
      "name": "Invoice & Billing Script",
      "tier": "Tier 2",
      "kind": "standalone",
      "catalogueStatus": "planned",
      "maturity": "planned",
      "manifestPath": null,
      "sourcePath": null,
      "releaseEvidence": "not_available"
    },
    {
      "sequence": 23,
      "productKey": "e-commerce-template",
      "name": "E-commerce Template",
      "tier": "Tier 2",
      "kind": "standalone",
      "catalogueStatus": "planned",
      "maturity": "planned",
      "manifestPath": null,
      "sourcePath": null,
      "releaseEvidence": "not_available"
    },
    {
      "sequence": 24,
      "productKey": "restaurant-template",
      "name": "Restaurant Template",
      "tier": "Tier 2",
      "kind": "standalone",
      "catalogueStatus": "planned",
      "maturity": "planned",
      "manifestPath": null,
      "sourcePath": null,
      "releaseEvidence": "not_available"
    },
    {
      "sequence": 25,
      "productKey": "hospital-template",
      "name": "Hospital Template",
      "tier": "Tier 2",
      "kind": "standalone",
      "catalogueStatus": "planned",
      "maturity": "planned",
      "manifestPath": null,
      "sourcePath": null,
      "releaseEvidence": "not_available"
    },
    {
      "sequence": 26,
      "productKey": "school-template",
      "name": "School Template",
      "tier": "Tier 2",
      "kind": "standalone",
      "catalogueStatus": "planned",
      "maturity": "planned",
      "manifestPath": null,
      "sourcePath": null,
      "releaseEvidence": "not_available"
    },
    {
      "sequence": 27,
      "productKey": "saas-dashboard-template",
      "name": "SaaS Dashboard Template",
      "tier": "Tier 2",
      "kind": "standalone",
      "catalogueStatus": "planned",
      "maturity": "planned",
      "manifestPath": null,
      "sourcePath": null,
      "releaseEvidence": "not_available"
    },
    {
      "sequence": 28,
      "productKey": "point-of-sale-pos-script",
      "name": "Point-of-Sale (POS) Script",
      "tier": "Tier 2",
      "kind": "standalone",
      "catalogueStatus": "planned",
      "maturity": "planned",
      "manifestPath": null,
      "sourcePath": null,
      "releaseEvidence": "not_available"
    },
    {
      "sequence": 29,
      "productKey": "centralized-exchange-cex-lite",